{
  "submission_id": "acmetech-arch-005",
  "team_name": "AcmeTech E-Commerce Team",
  "submission_date": "2024-02-28T11:20:00Z",
  "system_overview": {
    "title": "AI-Powered Supply Chain (2024)",
    "description": "Modern distributed architecture with AI/ML components for demand forecasting and automated inventory optimization."
  },
  "sections": {
    "architecture_diagram": "Architecture diagram for AI-Powered Supply Chain (2024)",
    "components": [
      "GraphQL API Gateway",
      "Order Processing Service",
      "Inventory Optimization Service",
      "Demand Forecasting Service (ML)",
      "Supply Chain Orchestrator",
      "Shipping Optimization Service",
      "Customer Analytics Service",
      "Event Streaming Platform",
      "Multi-Region Database Cluster"
    ],
    "data_flow": "GraphQL federation for API composition. Event-driven communication between services. ML models integrated via prediction APIs.",
    "scalability_considerations": "Kubernetes HPA, multi-region deployment, AI model serving at scale.",
    "security_measures": "Zero-trust architecture, service mesh (Istio), encrypted communications.",
    "deployment_strategy": "GitOps with ArgoCD, canary deployments, automated rollbacks.",
    "monitoring_logging": "Observability platform with metrics, logs, traces, and AI-powered anomaly detection.",
    "risks_concerns": "AI model accuracy and bias, increased complexity, higher operational costs."
  }
}